{
  "schemaVersion": 1,
  "deviceType": "Television",
  "manufacturer": "Dynex",
  "model": "DX-RC01A-12",
  "verification": "community-capture",
  "controlMethods": [
    {
      "transport": "infrared",
      "protocol": "NECext",
      "kind": "commands",
      "frequencyHz": 0,
      "commands": [
        {
          "name": "Power",
          "canonical": "Power",
          "type": "parsed",
          "address": "86 05 00 00",
          "command": "0F F0 00 00"
        },
        {
          "name": "Input",
          "canonical": "Source",
          "type": "parsed",
          "address": "86 05 00 00",
          "command": "1D E2 00 00"
        },
        {
          "name": "Vol_up",
          "canonical": "VolumeUp",
          "type": "parsed",
          "address": "86 05 00 00",
          "command": "0C F3 00 00"
        },
        {
          "name": "Vol_dn",
          "canonical": "VolumeDown",
          "type": "parsed",
          "address": "86 05 00 00",
          "command": "0D F2 00 00"
        },
        {
          "name": "Ch_next",
          "canonical": "ChannelUp",
          "type": "parsed",
          "address": "86 05 00 00",
          "command": "0A F5 00 00"
        },
        {
          "name": "Ch_prev",
          "canonical": "ChannelDown",
          "type": "parsed",
          "address": "86 05 00 00",
          "command": "0B F4 00 00"
        },
        {
          "name": "Mute",
          "canonical": "Mute",
          "type": "parsed",
          "address": "86 05 00 00",
          "command": "0E F1 00 00"
        },
        {
          "name": "Menu",
          "canonical": "Menu",
          "type": "parsed",
          "address": "86 05 00 00",
          "command": "14 EB 00 00"
        },
        {
          "name": "Exit",
          "canonical": "Exit",
          "type": "parsed",
          "address": "86 05 00 00",
          "command": "1B E4 00 00"
        },
        {
          "name": "Info",
          "canonical": "Info",
          "type": "parsed",
          "address": "86 05 00 00",
          "command": "17 E8 00 00"
        },
        {
          "name": "Guide",
          "canonical": "Guide",
          "type": "parsed",
          "address": "86 05 00 00",
          "command": "45 BA 00 00"
        },
        {
          "name": "Enter",
          "canonical": "Ok",
          "type": "parsed",
          "address": "86 05 00 00",
          "command": "18 E7 00 00"
        },
        {
          "name": "Up",
          "canonical": "Up",
          "type": "parsed",
          "address": "86 05 00 00",
          "command": "42 BD 00 00"
        },
        {
          "name": "Left",
          "canonical": "Left",
          "type": "parsed",
          "address": "86 05 00 00",
          "command": "16 E9 00 00"
        },
        {
          "name": "Right",
          "canonical": "Right",
          "type": "parsed",
          "address": "86 05 00 00",
          "command": "15 EA 00 00"
        },
        {
          "name": "Favorite",
          "canonical": "Custom2",
          "type": "parsed",
          "address": "86 05 00 00",
          "command": "4B B4 00 00"
        },
        {
          "name": "Video",
          "canonical": "Custom3",
          "type": "parsed",
          "address": "86 05 00 00",
          "command": "4C B3 00 00"
        },
        {
          "name": "Hdmi",
          "canonical": "Custom4",
          "type": "parsed",
          "address": "86 05 00 00",
          "command": "50 AF 00 00"
        },
        {
          "name": "Tv",
          "canonical": "Custom5",
          "type": "parsed",
          "address": "86 05 00 00",
          "command": "4F B0 00 00"
        },
        {
          "name": "Comp",
          "canonical": "Custom6",
          "type": "parsed",
          "address": "86 05 00 00",
          "command": "4D B2 00 00"
        },
        {
          "name": "Mts_sap",
          "canonical": "Custom7",
          "type": "parsed",
          "address": "86 05 00 00",
          "command": "11 EE 00 00"
        },
        {
          "name": "Vga",
          "canonical": "Custom8",
          "type": "parsed",
          "address": "86 05 00 00",
          "command": "4E B1 00 00"
        },
        {
          "name": "Sleep",
          "canonical": "Sleep",
          "type": "parsed",
          "address": "86 05 00 00",
          "command": "13 EC 00 00"
        },
        {
          "name": "Ch_list",
          "canonical": "ChannelList",
          "type": "parsed",
          "address": "86 05 00 00",
          "command": "86 79 00 00"
        },
        {
          "name": "1",
          "canonical": "Digit1",
          "type": "parsed",
          "address": "86 05 00 00",
          "command": "00 FF 00 00"
        },
        {
          "name": "2",
          "canonical": "Digit2",
          "type": "parsed",
          "address": "86 05 00 00",
          "command": "01 FE 00 00"
        },
        {
          "name": "3",
          "canonical": "Digit3",
          "type": "parsed",
          "address": "86 05 00 00",
          "command": "02 FD 00 00"
        },
        {
          "name": "4",
          "canonical": "Digit4",
          "type": "parsed",
          "address": "86 05 00 00",
          "command": "03 FC 00 00"
        },
        {
          "name": "5",
          "canonical": "Digit5",
          "type": "parsed",
          "address": "86 05 00 00",
          "command": "01 FE 00 00"
        },
        {
          "name": "6",
          "canonical": "Digit6",
          "type": "parsed",
          "address": "86 05 00 00",
          "command": "05 FA 00 00"
        },
        {
          "name": "7",
          "canonical": "Digit7",
          "type": "parsed",
          "address": "86 05 00 00",
          "command": "06 F9 00 00"
        },
        {
          "name": "8",
          "canonical": "Digit8",
          "type": "parsed",
          "address": "86 05 00 00",
          "command": "07 F8 00 00"
        },
        {
          "name": "9",
          "canonical": "Digit9",
          "type": "parsed",
          "address": "86 05 00 00",
          "command": "08 F7 00 00"
        },
        {
          "name": "0",
          "canonical": "Digit0",
          "type": "parsed",
          "address": "86 05 00 00",
          "command": "09 F6 00 00"
        }
      ]
    },
    {
      "transport": "infrared",
      "protocol": "",
      "kind": "commands",
      "frequencyHz": 38000,
      "commands": [
        {
          "name": "Dn",
          "canonical": "Custom1",
          "type": "raw",
          "frequencyHz": 38000,
          "data": [
            8990,
            3428,
            197,
            822,
            619,
            543,
            590,
            1670,
            596,
            1663,
            592,
            545,
            588,
            550,
            593,
            544,
            589,
            549,
            594,
            1665,
            590,
            1668,
            587,
            550,
            593,
            1666,
            589,
            548,
            595,
            543,
            590,
            548,
            595,
            542,
            591,
            547,
            596,
            1663,
            592,
            1666,
            589,
            548,
            595,
            542,
            591,
            547,
            596,
            541,
            592,
            1668,
            587,
            549,
            594,
            544,
            589,
            548,
            595,
            1665,
            590,
            1668,
            587,
            1671,
            595,
            1665,
            590,
            547,
            596,
            1663,
            592,
            42384,
            8983,
            2211,
            621
          ]
        }
      ]
    }
  ],
  "sources": [
    {
      "type": "Flipper-IRDB",
      "path": "TVs/Dynex/Dynex_DX-RC01A-12.ir",
      "license": "CC0-1.0"
    }
  ]
}
