{
  "schemaVersion": 1,
  "deviceType": "Air Conditioner",
  "manufacturer": "Zenith",
  "model": "AC",
  "verification": "community-capture",
  "controlMethods": [
    {
      "transport": "infrared",
      "protocol": "NECext",
      "kind": "commands",
      "frequencyHz": 0,
      "commands": [
        {
          "name": "POWER",
          "canonical": "Power",
          "type": "parsed",
          "address": "81 66 00 00",
          "command": "81 7E 00 00"
        },
        {
          "name": "TEMP-",
          "canonical": "Custom1",
          "type": "parsed",
          "address": "81 66 00 00",
          "command": "8A 75 00 00"
        },
        {
          "name": "TEMP+",
          "canonical": "TemperatureUp",
          "type": "parsed",
          "address": "81 66 00 00",
          "command": "85 7A 00 00"
        },
        {
          "name": "Fan_speed",
          "canonical": "Custom2",
          "type": "parsed",
          "address": "81 66 00 00",
          "command": "99 66 00 00"
        },
        {
          "name": "Timer",
          "canonical": "Timer",
          "type": "parsed",
          "address": "81 66 00 00",
          "command": "9F 60 00 00"
        },
        {
          "name": "MODE",
          "canonical": "Custom3",
          "type": "parsed",
          "address": "81 66 00 00",
          "command": "9B 64 00 00"
        },
        {
          "name": "Energy_saver",
          "canonical": "Custom4",
          "type": "parsed",
          "address": "81 66 00 00",
          "command": "82 7D 00 00"
        }
      ]
    }
  ],
  "sources": [
    {
      "type": "Flipper-IRDB",
      "path": "ACs/Zenith/Zenith_AC.ir",
      "license": "CC0-1.0"
    }
  ]
}
