{
  "schemaVersion": 1,
  "deviceType": "Television",
  "manufacturer": "Platinum",
  "model": "PT2020LED",
  "verification": "community-capture",
  "controlMethods": [
    {
      "transport": "infrared",
      "protocol": "NECext",
      "kind": "commands",
      "frequencyHz": 0,
      "commands": [
        {
          "name": "Power",
          "canonical": "Power",
          "type": "parsed",
          "address": "00 7F 00 00",
          "command": "15 EA 00 00"
        },
        {
          "name": "Vol_up",
          "canonical": "VolumeUp",
          "type": "parsed",
          "address": "00 7F 00 00",
          "command": "1B E4 00 00"
        },
        {
          "name": "Vol_dn",
          "canonical": "VolumeDown",
          "type": "parsed",
          "address": "00 7F 00 00",
          "command": "1A E5 00 00"
        },
        {
          "name": "Mute",
          "canonical": "Mute",
          "type": "parsed",
          "address": "00 7F 00 00",
          "command": "16 E9 00 00"
        },
        {
          "name": "Ch_next",
          "canonical": "ChannelUp",
          "type": "parsed",
          "address": "00 7F 00 00",
          "command": "19 E6 00 00"
        },
        {
          "name": "Ch_prev",
          "canonical": "ChannelDown",
          "type": "parsed",
          "address": "00 7F 00 00",
          "command": "18 E7 00 00"
        },
        {
          "name": "Up",
          "canonical": "Up",
          "type": "parsed",
          "address": "00 7F 00 00",
          "command": "0C F3 00 00"
        },
        {
          "name": "Down",
          "canonical": "Down",
          "type": "parsed",
          "address": "00 7F 00 00",
          "command": "0D F2 00 00"
        },
        {
          "name": "Left",
          "canonical": "Left",
          "type": "parsed",
          "address": "00 7F 00 00",
          "command": "0F F0 00 00"
        },
        {
          "name": "Right",
          "canonical": "Right",
          "type": "parsed",
          "address": "00 7F 00 00",
          "command": "0E F1 00 00"
        },
        {
          "name": "Enter",
          "canonical": "Ok",
          "type": "parsed",
          "address": "00 7F 00 00",
          "command": "10 EF 00 00"
        },
        {
          "name": "1",
          "canonical": "Digit1",
          "type": "parsed",
          "address": "00 7F 00 00",
          "command": "01 FE 00 00"
        },
        {
          "name": "2",
          "canonical": "Digit2",
          "type": "parsed",
          "address": "00 7F 00 00",
          "command": "02 FD 00 00"
        },
        {
          "name": "3",
          "canonical": "Digit3",
          "type": "parsed",
          "address": "00 7F 00 00",
          "command": "03 FC 00 00"
        },
        {
          "name": "4",
          "canonical": "Digit4",
          "type": "parsed",
          "address": "00 7F 00 00",
          "command": "04 FB 00 00"
        },
        {
          "name": "5",
          "canonical": "Digit5",
          "type": "parsed",
          "address": "00 7F 00 00",
          "command": "05 FA 00 00"
        },
        {
          "name": "6",
          "canonical": "Digit6",
          "type": "parsed",
          "address": "00 7F 00 00",
          "command": "06 F9 00 00"
        },
        {
          "name": "7",
          "canonical": "Digit7",
          "type": "parsed",
          "address": "00 7F 00 00",
          "command": "07 F8 00 00"
        },
        {
          "name": "8",
          "canonical": "Digit8",
          "type": "parsed",
          "address": "00 7F 00 00",
          "command": "08 F7 00 00"
        },
        {
          "name": "9",
          "canonical": "Digit9",
          "type": "parsed",
          "address": "00 7F 00 00",
          "command": "09 F6 00 00"
        },
        {
          "name": "0",
          "canonical": "Digit0",
          "type": "parsed",
          "address": "00 7F 00 00",
          "command": "00 FF 00 00"
        },
        {
          "name": "Dtv_atv",
          "canonical": "Custom1",
          "type": "parsed",
          "address": "00 7F 00 00",
          "command": "0B F4 00 00"
        },
        {
          "name": "Pmode",
          "canonical": "Mode",
          "type": "parsed",
          "address": "00 7F 00 00",
          "command": "1D E2 00 00"
        },
        {
          "name": "Smode",
          "canonical": "Mode",
          "type": "parsed",
          "address": "00 7F 00 00",
          "command": "1E E1 00 00"
        },
        {
          "name": "Sleep",
          "canonical": "Sleep",
          "type": "parsed",
          "address": "00 7F 00 00",
          "command": "1C E3 00 00"
        },
        {
          "name": "Repeat",
          "canonical": "Custom4",
          "type": "parsed",
          "address": "00 7F 00 00",
          "command": "0A F5 00 00"
        },
        {
          "name": "Menu",
          "canonical": "Menu",
          "type": "parsed",
          "address": "00 7F 00 00",
          "command": "11 EE 00 00"
        },
        {
          "name": "Source",
          "canonical": "Source",
          "type": "parsed",
          "address": "00 7F 00 00",
          "command": "12 ED 00 00"
        },
        {
          "name": "Exit",
          "canonical": "Exit",
          "type": "parsed",
          "address": "00 7F 00 00",
          "command": "13 EC 00 00"
        },
        {
          "name": "Display",
          "canonical": "Custom5",
          "type": "parsed",
          "address": "00 7F 00 00",
          "command": "14 EB 00 00"
        },
        {
          "name": "Epg",
          "canonical": "Custom6",
          "type": "parsed",
          "address": "00 7F 00 00",
          "command": "55 AA 00 00"
        },
        {
          "name": "Lang_audio",
          "canonical": "Custom7",
          "type": "parsed",
          "address": "00 7F 00 00",
          "command": "17 E8 00 00"
        },
        {
          "name": "Reclist",
          "canonical": "Custom8",
          "type": "parsed",
          "address": "00 7F 00 00",
          "command": "40 BF 00 00"
        },
        {
          "name": "Red",
          "canonical": "Red",
          "type": "parsed",
          "address": "00 7F 00 00",
          "command": "53 AC 00 00"
        },
        {
          "name": "Green",
          "canonical": "Green",
          "type": "parsed",
          "address": "00 7F 00 00",
          "command": "52 AD 00 00"
        },
        {
          "name": "Yellow",
          "canonical": "Yellow",
          "type": "parsed",
          "address": "00 7F 00 00",
          "command": "51 AE 00 00"
        },
        {
          "name": "Blue",
          "canonical": "Blue",
          "type": "parsed",
          "address": "00 7F 00 00",
          "command": "50 AF 00 00"
        }
      ]
    }
  ],
  "sources": [
    {
      "type": "Flipper-IRDB",
      "path": "TVs/Platinum/Platinum_PT2020LED.ir",
      "license": "CC0-1.0"
    }
  ]
}
