{
  "schemaVersion": 1,
  "deviceType": "Television",
  "manufacturer": "Samsung",
  "model": "BN59-01385C",
  "verification": "community-capture",
  "controlMethods": [
    {
      "transport": "infrared",
      "protocol": "Samsung32",
      "kind": "commands",
      "frequencyHz": 0,
      "commands": [
        {
          "name": "Power",
          "canonical": "Power",
          "type": "parsed",
          "address": "07 00 00 00",
          "command": "E6 00 00 00"
        },
        {
          "name": "123",
          "canonical": "Custom1",
          "type": "parsed",
          "address": "07 00 00 00",
          "command": "D2 00 00 00"
        },
        {
          "name": "RGYB",
          "canonical": "Custom2",
          "type": "parsed",
          "address": "07 00 00 00",
          "command": "CE 00 00 00"
        },
        {
          "name": "Up",
          "canonical": "Up",
          "type": "parsed",
          "address": "07 00 00 00",
          "command": "60 00 00 00"
        },
        {
          "name": "Right",
          "canonical": "Right",
          "type": "parsed",
          "address": "07 00 00 00",
          "command": "62 00 00 00"
        },
        {
          "name": "Down",
          "canonical": "Down",
          "type": "parsed",
          "address": "07 00 00 00",
          "command": "61 00 00 00"
        },
        {
          "name": "Left",
          "canonical": "Left",
          "type": "parsed",
          "address": "07 00 00 00",
          "command": "65 00 00 00"
        },
        {
          "name": "OK",
          "canonical": "Ok",
          "type": "parsed",
          "address": "07 00 00 00",
          "command": "68 00 00 00"
        },
        {
          "name": "Back",
          "canonical": "Back",
          "type": "parsed",
          "address": "07 00 00 00",
          "command": "58 00 00 00"
        },
        {
          "name": "Home",
          "canonical": "Custom1",
          "type": "parsed",
          "address": "07 00 00 00",
          "command": "79 00 00 00"
        },
        {
          "name": "Play_pause",
          "canonical": "Custom4",
          "type": "parsed",
          "address": "07 00 00 00",
          "command": "B9 00 00 00"
        },
        {
          "name": "Plus",
          "canonical": "Custom5",
          "type": "parsed",
          "address": "07 00 00 00",
          "command": "07 00 00 00"
        },
        {
          "name": "Minus",
          "canonical": "Custom6",
          "type": "parsed",
          "address": "07 00 00 00",
          "command": "0B 00 00 00"
        },
        {
          "name": "Ch_next",
          "canonical": "ChannelUp",
          "type": "parsed",
          "address": "07 00 00 00",
          "command": "12 00 00 00"
        },
        {
          "name": "Ch_prev",
          "canonical": "ChannelDown",
          "type": "parsed",
          "address": "07 00 00 00",
          "command": "10 00 00 00"
        },
        {
          "name": "Netflix",
          "canonical": "Custom7",
          "type": "parsed",
          "address": "07 00 00 00",
          "command": "F3 00 00 00"
        },
        {
          "name": "Prime",
          "canonical": "Custom8",
          "type": "parsed",
          "address": "07 00 00 00",
          "command": "F4 00 00 00"
        }
      ]
    }
  ],
  "sources": [
    {
      "type": "Flipper-IRDB",
      "path": "TVs/Samsung/Samsung_BN59-01385C.ir",
      "license": "CC0-1.0"
    }
  ]
}
