{
  "schemaVersion": 1,
  "deviceType": "Television",
  "manufacturer": "Vizio",
  "model": "D32FM-K01",
  "verification": "community-capture",
  "controlMethods": [
    {
      "transport": "infrared",
      "protocol": "",
      "kind": "commands",
      "frequencyHz": 38000,
      "commands": [
        {
          "name": "Power",
          "canonical": "Power",
          "type": "raw",
          "frequencyHz": 38000,
          "data": [
            9219,
            4484,
            662,
            469,
            661,
            469,
            661,
            1627,
            660,
            471,
            658,
            474,
            656,
            499,
            631,
            499,
            631,
            499,
            631,
            1657,
            630,
            1657,
            631,
            500,
            630,
            1657,
            631,
            1657,
            631,
            1657,
            630,
            1657,
            631,
            1657,
            631,
            500,
            630,
            500,
            630,
            500,
            630,
            1657,
            630,
            500,
            631,
            500,
            630,
            500,
            631,
            500,
            630,
            1657,
            630,
            1658,
            630,
            1657,
            631,
            500,
            630,
            1657,
            631,
            1658,
            630,
            1658,
            630,
            1658,
            630,
            40107,
            9106,
            2202,
            631
          ]
        },
        {
          "name": "Vol_up",
          "canonical": "VolumeUp",
          "type": "raw",
          "frequencyHz": 38000,
          "data": [
            9218,
            4484,
            636,
            495,
            660,
            469,
            661,
            1627,
            660,
            471,
            658,
            472,
            658,
            474,
            656,
            475,
            655,
            474,
            656,
            1632,
            655,
            1632,
            656,
            474,
            657,
            1632,
            656,
            1631,
            657,
            1632,
            656,
            1631,
            656,
            1632,
            656,
            474,
            656,
            1632,
            655,
            475,
            656,
            474,
            657,
            474,
            656,
            474,
            656,
            474,
            656,
            474,
            656,
            1632,
            655,
            474,
            656,
            1632,
            656,
            1632,
            656,
            1632,
            656,
            1632,
            656,
            1632,
            656,
            1632,
            656,
            40103,
            9107,
            2177,
            655
          ]
        },
        {
          "name": "Vol_dn",
          "canonical": "VolumeDown",
          "type": "raw",
          "frequencyHz": 38000,
          "data": [
            9245,
            4429,
            689,
            467,
            662,
            468,
            661,
            1626,
            660,
            471,
            658,
            473,
            657,
            474,
            656,
            474,
            656,
            474,
            656,
            1631,
            657,
            1631,
            657,
            474,
            656,
            1631,
            656,
            1632,
            656,
            1631,
            657,
            1631,
            657,
            1631,
            656,
            1632,
            656,
            1631,
            657,
            474,
            656,
            474,
            656,
            474,
            657,
            474,
            656,
            474,
            656,
            474,
            657,
            474,
            656,
            474,
            656,
            1631,
            656,
            1632,
            656,
            1632,
            656,
            1632,
            656,
            1632,
            656,
            1631,
            656,
            40082,
            9109,
            2175,
            656
          ]
        },
        {
          "name": "Input",
          "canonical": "Source",
          "type": "raw",
          "frequencyHz": 38000,
          "data": [
            9245,
            4428,
            690,
            467,
            662,
            468,
            661,
            1626,
            660,
            470,
            659,
            472,
            658,
            473,
            657,
            474,
            656,
            474,
            656,
            1631,
            657,
            1631,
            657,
            474,
            657,
            1631,
            657,
            1631,
            657,
            1631,
            656,
            1631,
            657,
            1631,
            657,
            1631,
            657,
            1631,
            657,
            1631,
            657,
            1631,
            657,
            474,
            656,
            1631,
            657,
            474,
            656,
            474,
            656,
            474,
            657,
            474,
            656,
            474,
            656,
            474,
            656,
            1632,
            656,
            474,
            656,
            1632,
            655,
            1632,
            656,
            39720,
            9108,
            2175,
            656
          ]
        },
        {
          "name": "Up",
          "canonical": "Up",
          "type": "raw",
          "frequencyHz": 38000,
          "data": [
            153,
            4276,
            193
          ]
        },
        {
          "name": "Down",
          "canonical": "Down",
          "type": "raw",
          "frequencyHz": 38000,
          "data": [
            9217,
            4485,
            636,
            495,
            660,
            469,
            661,
            1627,
            659,
            471,
            658,
            473,
            657,
            474,
            656,
            475,
            655,
            475,
            655,
            1633,
            655,
            1633,
            655,
            475,
            655,
            1633,
            655,
            1633,
            655,
            1633,
            655,
            1632,
            656,
            1633,
            655,
            475,
            655,
            1633,
            655,
            1633,
            655,
            476,
            655,
            475,
            655,
            476,
            654,
            1633,
            655,
            475,
            655,
            1633,
            655,
            475,
            656,
            476,
            654,
            1633,
            654,
            1633,
            655,
            1633,
            655,
            475,
            655,
            1633,
            655,
            39716,
            9106,
            2177,
            656
          ]
        },
        {
          "name": "Settings",
          "canonical": "Custom1",
          "type": "raw",
          "frequencyHz": 38000,
          "data": [
            329,
            7862,
            467
          ]
        },
        {
          "name": "Mute",
          "canonical": "Mute",
          "type": "raw",
          "frequencyHz": 38000,
          "data": [
            9219,
            4485,
            636,
            495,
            660,
            469,
            661,
            1626,
            661,
            471,
            658,
            473,
            657,
            474,
            656,
            499,
            631,
            500,
            630,
            1657,
            630,
            1657,
            631,
            500,
            630,
            1657,
            630,
            1657,
            631,
            1657,
            631,
            1657,
            630,
            1657,
            631,
            1657,
            631,
            500,
            630,
            500,
            630,
            1657,
            631,
            500,
            630,
            500,
            630,
            500,
            630,
            500,
            631,
            500,
            630,
            1657,
            631,
            1657,
            631,
            500,
            630,
            1657,
            631,
            1658,
            630,
            1657,
            631,
            1658,
            630,
            39868,
            9106,
            2178,
            655
          ]
        }
      ]
    }
  ],
  "sources": [
    {
      "type": "Flipper-IRDB",
      "path": "TVs/Vizio/Vizio_D32FM-K01.ir",
      "license": "CC0-1.0"
    }
  ]
}
