{
  "schemaVersion": 1,
  "deviceType": "Television",
  "manufacturer": "Hisense",
  "model": "65K3300UW",
  "verification": "community-capture",
  "controlMethods": [
    {
      "transport": "infrared",
      "protocol": "NECext",
      "kind": "commands",
      "frequencyHz": 0,
      "commands": [
        {
          "name": "Power",
          "canonical": "Power",
          "type": "parsed",
          "address": "00 BF 00 00",
          "command": "0D F2 00 00"
        },
        {
          "name": "Vol_up",
          "canonical": "VolumeUp",
          "type": "parsed",
          "address": "00 BF 00 00",
          "command": "44 BB 00 00"
        },
        {
          "name": "Vol_dn",
          "canonical": "VolumeDown",
          "type": "parsed",
          "address": "00 BF 00 00",
          "command": "43 BC 00 00"
        },
        {
          "name": "Mute",
          "canonical": "Mute",
          "type": "parsed",
          "address": "00 BF 00 00",
          "command": "0E F1 00 00"
        },
        {
          "name": "Ch_next",
          "canonical": "ChannelUp",
          "type": "parsed",
          "address": "00 BF 00 00",
          "command": "4A B5 00 00"
        },
        {
          "name": "Ch_prev",
          "canonical": "ChannelDown",
          "type": "parsed",
          "address": "00 BF 00 00",
          "command": "4B B4 00 00"
        },
        {
          "name": "Up",
          "canonical": "Up",
          "type": "parsed",
          "address": "00 BF 00 00",
          "command": "16 E9 00 00"
        },
        {
          "name": "Down",
          "canonical": "Down",
          "type": "parsed",
          "address": "00 BF 00 00",
          "command": "17 E8 00 00"
        },
        {
          "name": "Left",
          "canonical": "Left",
          "type": "parsed",
          "address": "00 BF 00 00",
          "command": "19 E6 00 00"
        },
        {
          "name": "Right",
          "canonical": "Right",
          "type": "parsed",
          "address": "00 BF 00 00",
          "command": "18 E7 00 00"
        },
        {
          "name": "Ok",
          "canonical": "Ok",
          "type": "parsed",
          "address": "00 BF 00 00",
          "command": "15 EA 00 00"
        },
        {
          "name": "Input",
          "canonical": "Source",
          "type": "parsed",
          "address": "00 BF 00 00",
          "command": "12 ED 00 00"
        },
        {
          "name": "1",
          "canonical": "Digit1",
          "type": "parsed",
          "address": "00 BF 00 00",
          "command": "01 FE 00 00"
        },
        {
          "name": "2",
          "canonical": "Digit2",
          "type": "parsed",
          "address": "00 BF 00 00",
          "command": "02 FD 00 00"
        },
        {
          "name": "3",
          "canonical": "Digit3",
          "type": "parsed",
          "address": "00 BF 00 00",
          "command": "03 FC 00 00"
        },
        {
          "name": "4",
          "canonical": "Digit4",
          "type": "parsed",
          "address": "00 BF 00 00",
          "command": "04 FB 00 00"
        },
        {
          "name": "5",
          "canonical": "Digit5",
          "type": "parsed",
          "address": "00 BF 00 00",
          "command": "05 FA 00 00"
        },
        {
          "name": "6",
          "canonical": "Digit6",
          "type": "parsed",
          "address": "00 BF 00 00",
          "command": "06 F9 00 00"
        },
        {
          "name": "7",
          "canonical": "Digit7",
          "type": "parsed",
          "address": "00 BF 00 00",
          "command": "07 F8 00 00"
        },
        {
          "name": "8",
          "canonical": "Digit8",
          "type": "parsed",
          "address": "00 BF 00 00",
          "command": "08 F7 00 00"
        },
        {
          "name": "9",
          "canonical": "Digit9",
          "type": "parsed",
          "address": "00 BF 00 00",
          "command": "09 F6 00 00"
        },
        {
          "name": "0",
          "canonical": "Digit0",
          "type": "parsed",
          "address": "00 BF 00 00",
          "command": "00 FF 00 00"
        },
        {
          "name": "Red",
          "canonical": "Red",
          "type": "parsed",
          "address": "00 BF 00 00",
          "command": "52 AD 00 00"
        },
        {
          "name": "Green",
          "canonical": "Green",
          "type": "parsed",
          "address": "00 BF 00 00",
          "command": "53 AC 00 00"
        },
        {
          "name": "Yellow",
          "canonical": "Yellow",
          "type": "parsed",
          "address": "00 BF 00 00",
          "command": "54 AB 00 00"
        },
        {
          "name": "Blue",
          "canonical": "Blue",
          "type": "parsed",
          "address": "00 BF 00 00",
          "command": "55 AA 00 00"
        },
        {
          "name": "Back",
          "canonical": "Back",
          "type": "parsed",
          "address": "00 BF 00 00",
          "command": "48 B7 00 00"
        },
        {
          "name": "Exit",
          "canonical": "Exit",
          "type": "parsed",
          "address": "00 BF 00 00",
          "command": "5C A3 00 00"
        },
        {
          "name": "Home",
          "canonical": "Custom1",
          "type": "parsed",
          "address": "00 BF 00 00",
          "command": "20 DF 00 00"
        },
        {
          "name": "Options",
          "canonical": "Custom2",
          "type": "parsed",
          "address": "00 BF 00 00",
          "command": "14 EB 00 00"
        },
        {
          "name": "Livetv",
          "canonical": "Custom3",
          "type": "parsed",
          "address": "00 BF 00 00",
          "command": "1B E4 00 00"
        },
        {
          "name": "Tshift",
          "canonical": "Custom4",
          "type": "parsed",
          "address": "00 BF 00 00",
          "command": "51 AE 00 00"
        },
        {
          "name": "Subtitle",
          "canonical": "Custom5",
          "type": "parsed",
          "address": "00 BF 00 00",
          "command": "1F E0 00 00"
        },
        {
          "name": "Pause",
          "canonical": "Pause",
          "type": "parsed",
          "address": "00 BF 00 00",
          "command": "A9 56 00 00"
        },
        {
          "name": "Play",
          "canonical": "Play",
          "type": "parsed",
          "address": "00 BF 00 00",
          "command": "A8 57 00 00"
        },
        {
          "name": "Stop",
          "canonical": "Stop",
          "type": "parsed",
          "address": "00 BF 00 00",
          "command": "5A A5 00 00"
        },
        {
          "name": "Rewind",
          "canonical": "Rewind",
          "type": "parsed",
          "address": "00 BF 00 00",
          "command": "58 A7 00 00"
        },
        {
          "name": "Fastforward",
          "canonical": "Custom6",
          "type": "parsed",
          "address": "00 BF 00 00",
          "command": "59 A6 00 00"
        },
        {
          "name": "Info",
          "canonical": "Info",
          "type": "parsed",
          "address": "00 BF 00 00",
          "command": "0C F3 00 00"
        },
        {
          "name": "Ch_list",
          "canonical": "ChannelList",
          "type": "parsed",
          "address": "00 BF 00 00",
          "command": "21 DE 00 00"
        },
        {
          "name": "Epg",
          "canonical": "Custom7",
          "type": "parsed",
          "address": "00 BF 00 00",
          "command": "1D E2 00 00"
        },
        {
          "name": "Netflix",
          "canonical": "Custom8",
          "type": "parsed",
          "address": "00 BF 00 00",
          "command": "47 B8 00 00"
        }
      ]
    }
  ],
  "sources": [
    {
      "type": "Flipper-IRDB",
      "path": "TVs/Hisense/Hisense_65K3300UW.ir",
      "license": "CC0-1.0"
    }
  ]
}
