{
  "schemaVersion": 1,
  "deviceType": "Television",
  "manufacturer": "Soniq",
  "model": "QSP500TV6",
  "verification": "community-capture",
  "controlMethods": [
    {
      "transport": "infrared",
      "protocol": "NECext",
      "kind": "commands",
      "frequencyHz": 0,
      "commands": [
        {
          "name": "Power",
          "canonical": "Power",
          "type": "parsed",
          "address": "72 DD 00 00",
          "command": "10 EF 00 00"
        },
        {
          "name": "Input",
          "canonical": "Source",
          "type": "parsed",
          "address": "72 DD 00 00",
          "command": "1F E0 00 00"
        },
        {
          "name": "Menu",
          "canonical": "Menu",
          "type": "parsed",
          "address": "72 DD 00 00",
          "command": "5C A3 00 00"
        },
        {
          "name": "Info",
          "canonical": "Info",
          "type": "parsed",
          "address": "72 DD 00 00",
          "command": "08 F7 00 00"
        },
        {
          "name": "Ok",
          "canonical": "Ok",
          "type": "parsed",
          "address": "72 DD 00 00",
          "command": "5A A5 00 00"
        },
        {
          "name": "Up",
          "canonical": "Up",
          "type": "parsed",
          "address": "72 DD 00 00",
          "command": "5E A1 00 00"
        },
        {
          "name": "Down",
          "canonical": "Down",
          "type": "parsed",
          "address": "72 DD 00 00",
          "command": "56 A9 00 00"
        },
        {
          "name": "Left",
          "canonical": "Left",
          "type": "parsed",
          "address": "72 DD 00 00",
          "command": "5B A4 00 00"
        },
        {
          "name": "Right",
          "canonical": "Right",
          "type": "parsed",
          "address": "72 DD 00 00",
          "command": "58 A7 00 00"
        },
        {
          "name": "Mute",
          "canonical": "Mute",
          "type": "parsed",
          "address": "72 DD 00 00",
          "command": "11 EE 00 00"
        },
        {
          "name": "Vol_up",
          "canonical": "VolumeUp",
          "type": "parsed",
          "address": "72 DD 00 00",
          "command": "58 A7 00 00"
        },
        {
          "name": "Vol_dn",
          "canonical": "VolumeDown",
          "type": "parsed",
          "address": "72 DD 00 00",
          "command": "5B A4 00 00"
        },
        {
          "name": "Ch_next",
          "canonical": "ChannelUp",
          "type": "parsed",
          "address": "72 DD 00 00",
          "command": "5E A1 00 00"
        },
        {
          "name": "Ch_prev",
          "canonical": "ChannelDown",
          "type": "parsed",
          "address": "72 DD 00 00",
          "command": "56 A9 00 00"
        },
        {
          "name": "1",
          "canonical": "Digit1",
          "type": "parsed",
          "address": "72 DD 00 00",
          "command": "0E F1 00 00"
        },
        {
          "name": "2",
          "canonical": "Digit2",
          "type": "parsed",
          "address": "72 DD 00 00",
          "command": "06 F9 00 00"
        },
        {
          "name": "3",
          "canonical": "Digit3",
          "type": "parsed",
          "address": "72 DD 00 00",
          "command": "0F F0 00 00"
        },
        {
          "name": "4",
          "canonical": "Digit4",
          "type": "parsed",
          "address": "72 DD 00 00",
          "command": "12 ED 00 00"
        },
        {
          "name": "5",
          "canonical": "Digit5",
          "type": "parsed",
          "address": "72 DD 00 00",
          "command": "07 F8 00 00"
        },
        {
          "name": "6",
          "canonical": "Digit6",
          "type": "parsed",
          "address": "72 DD 00 00",
          "command": "13 EC 00 00"
        },
        {
          "name": "7",
          "canonical": "Digit7",
          "type": "parsed",
          "address": "72 DD 00 00",
          "command": "16 E9 00 00"
        },
        {
          "name": "8",
          "canonical": "Digit8",
          "type": "parsed",
          "address": "72 DD 00 00",
          "command": "02 FD 00 00"
        },
        {
          "name": "9",
          "canonical": "Digit9",
          "type": "parsed",
          "address": "72 DD 00 00",
          "command": "17 E8 00 00"
        },
        {
          "name": "0",
          "canonical": "Digit0",
          "type": "parsed",
          "address": "72 DD 00 00",
          "command": "1A E5 00 00"
        },
        {
          "name": "Exit",
          "canonical": "Exit",
          "type": "parsed",
          "address": "72 DD 00 00",
          "command": "54 AB 00 00"
        }
      ]
    }
  ],
  "sources": [
    {
      "type": "Flipper-IRDB",
      "path": "TVs/Soniq/Soniq_QSP500TV6.ir",
      "license": "CC0-1.0"
    }
  ]
}
