{
  "schemaVersion": 1,
  "deviceType": "Television",
  "manufacturer": "Bolva",
  "model": "TV",
  "verification": "community-capture",
  "controlMethods": [
    {
      "transport": "infrared",
      "protocol": "NECext",
      "kind": "commands",
      "frequencyHz": 0,
      "commands": [
        {
          "name": "Power",
          "canonical": "Power",
          "type": "parsed",
          "address": "02 7D 00 00",
          "command": "46 B9 00 00"
        },
        {
          "name": "Up",
          "canonical": "Up",
          "type": "parsed",
          "address": "02 7D 00 00",
          "command": "48 B7 00 00"
        },
        {
          "name": "Down",
          "canonical": "Down",
          "type": "parsed",
          "address": "02 7D 00 00",
          "command": "4D B2 00 00"
        },
        {
          "name": "Right",
          "canonical": "Right",
          "type": "parsed",
          "address": "02 7D 00 00",
          "command": "49 B6 00 00"
        },
        {
          "name": "Left",
          "canonical": "Left",
          "type": "parsed",
          "address": "02 7D 00 00",
          "command": "4E B1 00 00"
        },
        {
          "name": "Ok",
          "canonical": "Ok",
          "type": "parsed",
          "address": "02 7D 00 00",
          "command": "4A B5 00 00"
        },
        {
          "name": "Mute",
          "canonical": "Mute",
          "type": "parsed",
          "address": "02 7D 00 00",
          "command": "4C B3 00 00"
        },
        {
          "name": "Menu",
          "canonical": "Menu",
          "type": "parsed",
          "address": "02 7D 00 00",
          "command": "45 BA 00 00"
        },
        {
          "name": "Source",
          "canonical": "Source",
          "type": "parsed",
          "address": "02 7D 00 00",
          "command": "4B B4 00 00"
        },
        {
          "name": "Return",
          "canonical": "Back",
          "type": "parsed",
          "address": "02 7D 00 00",
          "command": "16 E9 00 00"
        },
        {
          "name": "Exit",
          "canonical": "Exit",
          "type": "parsed",
          "address": "02 7D 00 00",
          "command": "0D F2 00 00"
        },
        {
          "name": "Aspect",
          "canonical": "Custom1",
          "type": "parsed",
          "address": "02 7D 00 00",
          "command": "52 AD 00 00"
        },
        {
          "name": "Tv",
          "canonical": "Custom2",
          "type": "parsed",
          "address": "02 7D 00 00",
          "command": "3F C0 00 00"
        },
        {
          "name": "Vol_up",
          "canonical": "VolumeUp",
          "type": "parsed",
          "address": "02 7D 00 00",
          "command": "0C F3 00 00"
        },
        {
          "name": "Vol_dn",
          "canonical": "VolumeDown",
          "type": "parsed",
          "address": "02 7D 00 00",
          "command": "19 E6 00 00"
        },
        {
          "name": "Ch_next",
          "canonical": "ChannelUp",
          "type": "parsed",
          "address": "02 7D 00 00",
          "command": "0F F0 00 00"
        },
        {
          "name": "Ch_prev",
          "canonical": "ChannelDown",
          "type": "parsed",
          "address": "02 7D 00 00",
          "command": "5A A5 00 00"
        },
        {
          "name": "Play_pause",
          "canonical": "Custom3",
          "type": "parsed",
          "address": "02 7D 00 00",
          "command": "5B A4 00 00"
        },
        {
          "name": "Next",
          "canonical": "Custom4",
          "type": "parsed",
          "address": "02 7D 00 00",
          "command": "17 E8 00 00"
        },
        {
          "name": "Previous",
          "canonical": "Custom5",
          "type": "parsed",
          "address": "02 7D 00 00",
          "command": "13 EC 00 00"
        },
        {
          "name": "Ff",
          "canonical": "Custom6",
          "type": "parsed",
          "address": "02 7D 00 00",
          "command": "56 A9 00 00"
        },
        {
          "name": "Rw",
          "canonical": "Custom7",
          "type": "parsed",
          "address": "02 7D 00 00",
          "command": "57 A8 00 00"
        },
        {
          "name": "Stop",
          "canonical": "Stop",
          "type": "parsed",
          "address": "02 7D 00 00",
          "command": "1A E5 00 00"
        },
        {
          "name": "1",
          "canonical": "Digit1",
          "type": "parsed",
          "address": "02 7D 00 00",
          "command": "01 FE 00 00"
        },
        {
          "name": "2",
          "canonical": "Digit2",
          "type": "parsed",
          "address": "02 7D 00 00",
          "command": "02 FD 00 00"
        },
        {
          "name": "3",
          "canonical": "Digit3",
          "type": "parsed",
          "address": "02 7D 00 00",
          "command": "03 FC 00 00"
        },
        {
          "name": "4",
          "canonical": "Digit4",
          "type": "parsed",
          "address": "02 7D 00 00",
          "command": "04 FB 00 00"
        },
        {
          "name": "5",
          "canonical": "Digit5",
          "type": "parsed",
          "address": "02 7D 00 00",
          "command": "05 FA 00 00"
        },
        {
          "name": "6",
          "canonical": "Digit6",
          "type": "parsed",
          "address": "02 7D 00 00",
          "command": "06 F9 00 00"
        },
        {
          "name": "7",
          "canonical": "Digit7",
          "type": "parsed",
          "address": "02 7D 00 00",
          "command": "07 F8 00 00"
        },
        {
          "name": "8",
          "canonical": "Digit8",
          "type": "parsed",
          "address": "02 7D 00 00",
          "command": "08 F7 00 00"
        },
        {
          "name": "9",
          "canonical": "Digit9",
          "type": "parsed",
          "address": "02 7D 00 00",
          "command": "09 F6 00 00"
        },
        {
          "name": "0",
          "canonical": "Digit0",
          "type": "parsed",
          "address": "02 7D 00 00",
          "command": "00 FF 00 00"
        },
        {
          "name": "_",
          "canonical": "Custom8",
          "type": "parsed",
          "address": "02 7D 00 00",
          "command": "42 BD 00 00"
        },
        {
          "name": "Ch_prev",
          "canonical": "ChannelDown",
          "type": "parsed",
          "address": "02 7D 00 00",
          "command": "41 BE 00 00"
        },
        {
          "name": "Ch_list",
          "canonical": "ChannelList",
          "type": "parsed",
          "address": "02 7D 00 00",
          "command": "44 BB 00 00"
        }
      ]
    }
  ],
  "sources": [
    {
      "type": "Flipper-IRDB",
      "path": "TVs/Bolva/Bolva_TV.ir",
      "license": "CC0-1.0"
    }
  ]
}
