{
  "schemaVersion": 1,
  "deviceType": "Television",
  "manufacturer": "Emerson",
  "model": "EWC13D4",
  "verification": "community-capture",
  "controlMethods": [
    {
      "transport": "infrared",
      "protocol": "NECext",
      "kind": "commands",
      "frequencyHz": 0,
      "commands": [
        {
          "name": "Power",
          "canonical": "Power",
          "type": "parsed",
          "address": "87 22 00 00",
          "command": "E0 1F 00 00"
        },
        {
          "name": "Picture",
          "canonical": "Custom1",
          "type": "parsed",
          "address": "87 22 00 00",
          "command": "C9 36 00 00"
        },
        {
          "name": "Select",
          "canonical": "Ok",
          "type": "parsed",
          "address": "87 22 00 00",
          "command": "CD 32 00 00"
        },
        {
          "name": "Eject",
          "canonical": "Custom2",
          "type": "parsed",
          "address": "87 22 00 00",
          "command": "44 BB 00 00"
        },
        {
          "name": "1",
          "canonical": "Digit1",
          "type": "parsed",
          "address": "87 22 00 00",
          "command": "DF 20 00 00"
        },
        {
          "name": "2",
          "canonical": "Digit2",
          "type": "parsed",
          "address": "87 22 00 00",
          "command": "E1 1E 00 00"
        },
        {
          "name": "3",
          "canonical": "Digit3",
          "type": "parsed",
          "address": "87 22 00 00",
          "command": "E2 1D 00 00"
        },
        {
          "name": "4",
          "canonical": "Digit4",
          "type": "parsed",
          "address": "87 22 00 00",
          "command": "E3 1C 00 00"
        },
        {
          "name": "5",
          "canonical": "Digit5",
          "type": "parsed",
          "address": "87 22 00 00",
          "command": "E4 1B 00 00"
        },
        {
          "name": "6",
          "canonical": "Digit6",
          "type": "parsed",
          "address": "87 22 00 00",
          "command": "E5 1A 00 00"
        },
        {
          "name": "7",
          "canonical": "Digit7",
          "type": "parsed",
          "address": "87 22 00 00",
          "command": "E6 19 00 00"
        },
        {
          "name": "8",
          "canonical": "Digit8",
          "type": "parsed",
          "address": "87 22 00 00",
          "command": "E7 18 00 00"
        },
        {
          "name": "9",
          "canonical": "Digit9",
          "type": "parsed",
          "address": "87 22 00 00",
          "command": "E8 17 00 00"
        },
        {
          "name": "0",
          "canonical": "Digit0",
          "type": "parsed",
          "address": "87 22 00 00",
          "command": "E9 16 00 00"
        },
        {
          "name": "Ch_next",
          "canonical": "ChannelUp",
          "type": "parsed",
          "address": "87 22 00 00",
          "command": "D0 2F 00 00"
        },
        {
          "name": "Ch_prev",
          "canonical": "ChannelDown",
          "type": "parsed",
          "address": "87 22 00 00",
          "command": "C8 37 00 00"
        },
        {
          "name": "Vol_up",
          "canonical": "VolumeUp",
          "type": "parsed",
          "address": "87 22 00 00",
          "command": "F0 0F 00 00"
        },
        {
          "name": "Vol_dn",
          "canonical": "VolumeDown",
          "type": "parsed",
          "address": "87 22 00 00",
          "command": "F1 0E 00 00"
        },
        {
          "name": "Sleep",
          "canonical": "Sleep",
          "type": "parsed",
          "address": "87 22 00 00",
          "command": "CB 34 00 00"
        },
        {
          "name": "+10/+100",
          "canonical": "Custom3",
          "type": "parsed",
          "address": "87 22 00 00",
          "command": "EC 13 00 00"
        },
        {
          "name": "Prev",
          "canonical": "Custom4",
          "type": "parsed",
          "address": "87 22 00 00",
          "command": "5D A2 00 00"
        },
        {
          "name": "Next",
          "canonical": "Custom5",
          "type": "parsed",
          "address": "87 22 00 00",
          "command": "5F A0 00 00"
        },
        {
          "name": "V.SURR",
          "canonical": "Custom6",
          "type": "parsed",
          "address": "87 22 00 00",
          "command": "81 7E 00 00"
        },
        {
          "name": "Mute",
          "canonical": "Mute",
          "type": "parsed",
          "address": "87 22 00 00",
          "command": "F3 0C 00 00"
        },
        {
          "name": "Play",
          "canonical": "Play",
          "type": "parsed",
          "address": "87 22 00 00",
          "command": "5E A1 00 00"
        },
        {
          "name": "Pause",
          "canonical": "Pause",
          "type": "parsed",
          "address": "87 22 00 00",
          "command": "5B A4 00 00"
        },
        {
          "name": "Stop",
          "canonical": "Stop",
          "type": "parsed",
          "address": "87 22 00 00",
          "command": "60 9F 00 00"
        },
        {
          "name": "Fast_ba",
          "canonical": "Custom7",
          "type": "parsed",
          "address": "87 22 00 00",
          "command": "52 AD 00 00"
        },
        {
          "name": "Fast_fo",
          "canonical": "Custom8",
          "type": "parsed",
          "address": "87 22 00 00",
          "command": "53 AC 00 00"
        },
        {
          "name": "Up",
          "canonical": "Up",
          "type": "parsed",
          "address": "87 22 00 00",
          "command": "F6 09 00 00"
        },
        {
          "name": "Down",
          "canonical": "Down",
          "type": "parsed",
          "address": "87 22 00 00",
          "command": "F7 08 00 00"
        },
        {
          "name": "Left",
          "canonical": "Left",
          "type": "parsed",
          "address": "87 22 00 00",
          "command": "C7 38 00 00"
        },
        {
          "name": "Right",
          "canonical": "Right",
          "type": "parsed",
          "address": "87 22 00 00",
          "command": "C6 39 00 00"
        },
        {
          "name": "Ok",
          "canonical": "Ok",
          "type": "parsed",
          "address": "87 22 00 00",
          "command": "72 8D 00 00"
        },
        {
          "name": "Back",
          "canonical": "Back",
          "type": "parsed",
          "address": "87 22 00 00",
          "command": "73 8C 00 00"
        }
      ]
    }
  ],
  "sources": [
    {
      "type": "Flipper-IRDB",
      "path": "TVs/Emerson/Emerson_EWC13D4.ir",
      "license": "CC0-1.0"
    }
  ]
}
